<?xml version="1.0" encoding="UTF-8"?>
<!DOCTYPE structure SYSTEM "../../schemas/structure.dtd">
<structure deck="zen">
  <hierarchy>
    <level name="strand" label="Strand"/>
  </hierarchy>

  <group type="strand" value="gate" label="The Gate" count="1">
    <card id="00" order="1"/>
  </group>

  <group type="strand" value="way" label="The Way" count="10">
    <card id="01" order="1"/>
    <card id="02" order="2"/>
    <card id="03" order="3"/>
    <card id="04" order="4"/>
    <card id="05" order="5"/>
    <card id="06" order="6"/>
    <card id="07" order="7"/>
    <card id="08" order="8"/>
    <card id="09" order="9"/>
    <card id="10" order="10"/>
  </group>

  <group type="strand" value="transmission" label="The Transmission" count="7">
    <card id="11" order="1"/>
    <card id="12" order="2"/>
    <card id="13" order="3"/>
    <card id="14" order="4"/>
    <card id="15" order="5"/>
    <card id="16" order="6"/>
    <card id="17" order="7"/>
  </group>
</structure>
